{"created_at":"2026-08-12T12:00:00Z","decisions":[{"action":"copy-exact-snapshot","parameters":{},"reason":"Duplicate preserves the exact verified Capsule snapshot.","scope":"application","subject":"org.example.app"}],"expected":{"app_id":"org.example.app","application_digest":"3333333333333333333333333333333333333333333333333333333333333333","capsule_id":"c7e6586e-d489-48d0-b1a0-e98499fb542a","data_schema_id":"org.example.data","data_schema_version":1,"revision_id":"80b1d11e-76fe-45be-a941-a448614d1a59"},"expires_at":"2026-08-12T12:05:00Z","inputs":[{"capsule":{"app_id":"org.example.app","app_version":"1.0.0","application_digest":"3333333333333333333333333333333333333333333333333333333333333333","capsule_id":"c7e6586e-d489-48d0-b1a0-e98499fb542a","data_schema_id":"org.example.data","data_schema_version":1,"format_version":"0.3","publisher_key_id":"ed25519:sha256:test","revision_id":"80b1d11e-76fe-45be-a941-a448614d1a59"},"file_sha256":"1111111111111111111111111111111111111111111111111111111111111111","filesystem_identity":{"file_id_or_inode":"file:2","modified_ns":123,"platform":"windows","volume_or_device":"volume:1"},"path_hint":"source.capsule.sqlite","role":"source","size_bytes":4096,"snapshot_sha256":"2222222222222222222222222222222222222222222222222222222222222222"}],"limits":{"deadline_ms":300000,"max_input_bytes":67108864,"max_output_bytes":67108864,"max_rows_inspected":100000,"max_rows_written":100000},"operation":"duplicate","output":{"leaf_name":"Copy.capsule.sqlite","must_not_exist":true,"parent_filesystem_identity":{"file_id_or_inode":"directory:2","platform":"windows","volume_or_device":"volume:1"},"path":"Copy.capsule.sqlite","publish_mode":"create-new-no-replace"},"plan_digest":"ccaa96b347b0732e2a911384b76a203efe38fe0e57d2ac7c24eb30dd6df90e20","plan_id":"c5f44498-1a23-4c15-a384-e8a4782d0984","profile":"org.sqlite-capsule.lifecycle-plan/1"}