{"created_at":"2026-08-13T08:00:00Z","decisions":[{"action":"bind-reconcile-payload","parameters":{"reconcile_payload_digest":"04fe9f6381457e94fb4f778a076a75dbc8d74d1361209b8d0e86e044eb141486"},"reason":"Apply only the exact reviewed value-free reconciliation payload to a new target-derived copy.","scope":"application","subject":"org.example.notes"}],"expected":{"app_id":"org.example.notes","application_digest":"5353535353535353535353535353535353535353535353535353535353535353","capsule_id":"fd48aa17-fb96-4716-97fc-0c40fd23ed2a","data_schema_id":"org.example.notes-data","data_schema_version":1,"revision_id":"b5eff64a-7244-46f1-b5d6-34735579eef6"},"expires_at":"2026-08-13T08:05:00Z","inputs":[{"capsule":{"app_id":"org.example.notes","app_version":"1.0.0","application_digest":"5353535353535353535353535353535353535353535353535353535353535353","capsule_id":"8a89b412-32ec-49ec-9e61-bce3538fa8d2","data_schema_id":"org.example.notes-data","data_schema_version":1,"format_version":"0.3","publisher_key_id":"ed25519:sha256:source","revision_id":"39dd777e-f135-4ab0-8924-4c04570dde65"},"file_sha256":"5151515151515151515151515151515151515151515151515151515151515151","filesystem_identity":{"file_id_or_inode":"file:source","modified_ns":1000,"platform":"windows","volume_or_device":"volume:1"},"path_hint":"Source.capsule.sqlite","role":"source","size_bytes":8192,"snapshot_sha256":"5252525252525252525252525252525252525252525252525252525252525252"},{"capsule":{"app_id":"org.example.notes","app_version":"1.0.0","application_digest":"5353535353535353535353535353535353535353535353535353535353535353","capsule_id":"fd48aa17-fb96-4716-97fc-0c40fd23ed2a","data_schema_id":"org.example.notes-data","data_schema_version":1,"format_version":"0.3","publisher_key_id":"ed25519:sha256:target","revision_id":"b117c3ad-4205-43a9-b0d0-9d4f8dfa5734"},"file_sha256":"5454545454545454545454545454545454545454545454545454545454545454","filesystem_identity":{"file_id_or_inode":"file:target","modified_ns":2000,"platform":"windows","volume_or_device":"volume:1"},"path_hint":"Target.capsule.sqlite","role":"target","size_bytes":8192,"snapshot_sha256":"5555555555555555555555555555555555555555555555555555555555555555"},{"capsule":{"app_id":"org.example.notes","app_version":"1.0.0","application_digest":"5353535353535353535353535353535353535353535353535353535353535353","capsule_id":"fd48aa17-fb96-4716-97fc-0c40fd23ed2a","data_schema_id":"org.example.notes-data","data_schema_version":1,"format_version":"0.3","publisher_key_id":"ed25519:sha256:ancestor","revision_id":"fa0210e4-1d38-43ec-8a23-4a26e783b28e"},"file_sha256":"5656565656565656565656565656565656565656565656565656565656565656","filesystem_identity":{"file_id_or_inode":"file:ancestor","modified_ns":500,"platform":"windows","volume_or_device":"volume:1"},"path_hint":"Ancestor.capsule.sqlite","role":"ancestor","size_bytes":8192,"snapshot_sha256":"5757575757575757575757575757575757575757575757575757575757575757"}],"limits":{"deadline_ms":30000,"max_input_bytes":67108864,"max_output_bytes":67108864,"max_rows_inspected":100000,"max_rows_written":100000},"operation":"reconcile-to-copy","output":{"leaf_name":"Reconciled.capsule.sqlite","must_not_exist":true,"parent_filesystem_identity":{"file_id_or_inode":"directory:output","platform":"windows","volume_or_device":"volume:1"},"path":"Reconciled.capsule.sqlite","publish_mode":"create-new-no-replace"},"plan_digest":"899ce7b66378adac5251f85bbbdb4008d109d2a9f21f4c56d426644b3d539fc7","plan_id":"91967b4a-8cc0-4f0a-a9a4-78bc53b46490","profile":"org.sqlite-capsule.lifecycle-plan/1"}