{"created_at":"2026-08-13T12:00:00Z","decisions":[{"action":"semantic-copy-v1","parameters":{"event_id":"ec17dd8d-1d1c-4bed-a6ab-bcff01f11eb4","instance_profile":"org.sqlite-capsule.semantic-fork-instance-preserve-text-clear-assets/1","mode":"fork","mutable_platform_profile":"org.sqlite-capsule.semantic-mutable-reset/1","occurred_at":"2026-08-13T12:00:00Z","signature_count":1,"signature_inventory_sha256":"4444444444444444444444444444444444444444444444444444444444444444","template_state_sha256":null},"reason":"Host-owned semantic copy with signed dataset-policy enforcement.","scope":"application","subject":"org.example.app"},{"action":"copy","parameters":{"fork_policy":"copy","sensitive_confirmed":false,"sensitivity":"normal","source_row_count":2,"source_state_profile":"org.sqlite-capsule.dataset-state/1","source_state_sha256":"5555555555555555555555555555555555555555555555555555555555555555"},"reason":"Derived from the signed dataset contract and closed host choices.","scope":"dataset","subject":"content"}],"expected":{"app_id":"org.example.app","application_digest":"3333333333333333333333333333333333333333333333333333333333333333","capsule_id":"59e233ce-fdc8-4319-8ee9-fea93320d07f","data_schema_id":"org.example.data","data_schema_version":1,"revision_id":"e222ec17-dcb9-476f-8923-49d34735ec9c"},"expires_at":"2026-08-13T12:05:00Z","inputs":[{"capsule":{"app_id":"org.example.app","app_version":"1.0.0","application_digest":"3333333333333333333333333333333333333333333333333333333333333333","capsule_id":"c7e6586e-d489-48d0-b1a0-e98499fb542a","data_schema_id":"org.example.data","data_schema_version":1,"format_version":"0.3","publisher_key_id":null,"revision_id":"80b1d11e-76fe-45be-a941-a448614d1a59"},"file_sha256":"1111111111111111111111111111111111111111111111111111111111111111","filesystem_identity":{"file_id_or_inode":"file:1","modified_ns":123,"platform":"windows","volume_or_device":"volume:1"},"path_hint":"source.capsule.sqlite","role":"source","size_bytes":4096,"snapshot_sha256":"1111111111111111111111111111111111111111111111111111111111111111"}],"limits":{"deadline_ms":30000,"max_input_bytes":67108864,"max_output_bytes":67108864,"max_rows_inspected":100000,"max_rows_written":100000},"operation":"fork","output":{"leaf_name":"Fork.capsule.sqlite","must_not_exist":true,"parent_filesystem_identity":{"file_id_or_inode":"directory:2","platform":"windows","volume_or_device":"volume:1"},"path":"Fork.capsule.sqlite","publish_mode":"create-new-no-replace"},"plan_digest":"0b69951f3ca28a6917ec0b51ab049cf622a7a8f5dd75fd2bc2fada5edc675e37","plan_id":"8d84b1e7-5ed9-4776-94da-497dc5105c85","profile":"org.sqlite-capsule.lifecycle-plan/1"}